{
  "$schema": "../theme.schema.json",
  "id": "oms",
  "name": "Polygon Labs' Open Money Stack",
  "description": "OMS financial product theme with white surfaces, slate neutrals, Fustat typography, sparse purple accents, and precise functional copy.",
  "typography": {
    "fontFamily": "Fustat",
    "headingWeight": 700,
    "bodyWeight": 500,
    "lineHeight": 1.2
  },
  "colors": {
    "page": "#F6F6FC",
    "surface": "#FFFFFF",
    "secondarySurface": "#F6F6FC",
    "header": "#FFFFFF",
    "headerBorder": "#DFE3F0",
    "footer": "#FFFFFF",
    "primaryText": "#141635",
    "secondaryText": "#64708F",
    "placeholderText": "#929EBA",
    "border": "#C8CFE1",
    "focusRing": "#670DE5",
    "brand": "#670DE5",
    "primaryButton": "#090624",
    "primaryButtonText": "#FFFFFF",
    "secondaryButton": "#FFFFFF",
    "secondaryButtonText": "#090624",
    "danger": "#DC2626",
    "dangerSoft": "#FEF2F2",
    "dangerText": "#FFFFFF",
    "success": "#047857",
    "successSoft": "#ECFDF5",
    "warning": "#B45309",
    "warningSoft": "#FFF7ED",
    "info": "#670DE5",
    "infoSoft": "#F5F2FA"
  },
  "components": {
    "usesBorders": true
  }
}
